{
  "$schema": "http://json-schema.org/draft-07/schema#",
  "$id": "framework.schema.json",
  "title": "Methodological Framework",
  "description": "A structured programming approach. This is the level where session allocation decisions are made \u2014 how many of what type of session per week, and in what proportion.",
  "type": "object",
  "required": [
    "id",
    "name",
    "source_philosophy",
    "sessions_per_week",
    "progression_model"
  ],
  "additionalProperties": false,
  "properties": {
    "id": {
      "type": "string",
      "pattern": "^[a-z0-9_]+$",
      "description": "Unique slug. e.g. 'linear_progression', 'polarized_80_20', 'concurrent_training'"
    },
    "name": {
      "type": "string",
      "description": "Human-readable name. e.g. 'Linear Progression (SS)'"
    },
    "source_philosophy": {
      "type": "string",
      "description": "ID of the philosophy this framework derives from. Must match a philosophy.id."
    },
    "goals_served": {
      "type": "array",
      "description": "Goal profile IDs or modality IDs this framework is designed to support.",
      "items": {
        "type": "string"
      }
    },
    "sessions_per_week": {
      "type": "object",
      "description": "How many sessions of each type this framework prescribes per week. Keys are modality IDs or session type labels.",
      "additionalProperties": {
        "type": "number",
        "minimum": 0,
        "maximum": 7
      },
      "examples": [
        {
          "max_strength": 3,
          "aerobic_base": 2,
          "mobility": 1
        }
      ]
    },
    "intensity_distribution": {
      "type": "object",
      "description": "What fraction of sessions fall into each intensity zone. Fractions should sum to 1.0.",
      "properties": {
        "zone1_2_pct": {
          "type": "number",
          "minimum": 0,
          "maximum": 1
        },
        "zone3_pct": {
          "type": "number",
          "minimum": 0,
          "maximum": 1
        },
        "zone4_5_pct": {
          "type": "number",
          "minimum": 0,
          "maximum": 1
        },
        "max_effort_pct": {
          "type": "number",
          "minimum": 0,
          "maximum": 1
        }
      },
      "additionalProperties": false
    },
    "progression_defaults": {
      "type": "object",
      "description": "This framework's weekly ramps, over the commons' (data/commons/progression.yaml): the share added each week up to the phase kind's ceiling — `time` a timed block's minutes and a heart-rate-gated interval's rounds (0.10), `distance` a distance slot's metres (0.08). src/progression.ramps_for.",
      "additionalProperties": false,
      "properties": {
        "ramps": {
          "type": "object",
          "additionalProperties": false,
          "properties": {
            "time": {"type": "number", "minimum": 0, "maximum": 1},
            "distance": {"type": "number", "minimum": 0, "maximum": 1}
          }
        }
      }
    },
    "progression_overrides": {
      "type": "object",
      "description": "Modality id -> progression model that writes the load for that modality's sessions in this framework's weeks. Without an entry the modality's own progression_model does, as for every other framework (src/generator.py). Marcus Filly's RPE framework prescribes its strength work as RPE targets this way; the framework-level progression_model never drove a prescription.",
      "additionalProperties": {
        "type": "string",
        "enum": ["linear_load", "density", "volume_block", "complexity", "time_to_task",
                 "intensity_split_shift", "rpe_autoregulation", "pentathlon_rpm", "range_progression",
                 "as_written"]
      }
    },
    "prescription_policy": {
      "enum": [
        "modality",
        "framework"
      ],
      "description": "Opt-in authority for legacy slot prescriptions; methodology contracts carry explicit per-module models."
    },
    "progression_model": {
      "type": "string",
      "description": "ID of the progression model that governs advancement in this framework.",
      "enum": [
        "linear_load",
        "density",
        "volume_block",
        "complexity",
        "time_to_task",
        "intensity_split_shift",
        "rpe_autoregulation",
        "pentathlon_rpm",
        "range_progression",
        "as_written"
      ]
    },
    "categories": {
      "type": "object",
      "description": "Day categories for phases that declare `week_templates` (philosophy.yaml): the source's own kinds of day (Horsemen's strength, power endurance, job specific...). Each is a pool of named-workout archetypes taken in rotation; the generator picks the next one the athlete can do as written (level, equipment, injuries, time). Category ids are what a week template names.",
      "propertyNames": {"pattern": "^[a-z0-9_]+$"},
      "additionalProperties": {
        "type": "object",
        "required": ["name", "modality", "archetypes"],
        "additionalProperties": false,
        "properties": {
          "name": {"type": "string"},
          "modality": {"type": "string", "pattern": "^[a-z0-9_]+$", "description": "The session's modality (colour, analytics family)."},
          "archetypes": {"type": "array", "minItems": 1, "items": {"type": "string", "pattern": "^[a-z0-9_]+$"},
                         "description": "The pool, in the rotation's order."},
          "warm_up": {"type": "boolean", "default": true, "description": "Prefix the day's session with a workout from `warm_up_category`."},
          "long_day": {"type": "boolean", "default": false, "description": "Its workouts need time: when the athlete's days differ in length, these days take the longest."},
          "fallback": {"type": "array", "items": {"type": "string", "pattern": "^[a-z0-9_]+$"},
                       "description": "Categories tried in order when no workout of this one fits the athlete; the week says so."},
          "advice": {"oneOf": [{"type": "string", "minLength": 1},
                               {"type": "object", "minProperties": 1, "additionalProperties": false,
                                "properties": {"novice": {"type": "string"}, "intermediate": {"type": "string"},
                                               "advanced": {"type": "string"}, "elite": {"type": "string"}}}],
                     "description": "The method's recommendation, left to the athlete: said once in each of the category's sessions, at its first movement, never acted on (when to move up a ladder or a version). Per training level when it differs (Ido's beginner and intermediate versions)."},
          "notes": {"type": "string"}
        }
      }
    },
    "warm_up_category": {
      "type": "string",
      "pattern": "^[a-z0-9_]+$",
      "description": "The category whose workouts open each templated training day (the source's 'WARM UP, ...')."
    },
    "applicable_when": {
      "type": "object",
      "description": "Conditions under which the system should select this framework. All specified conditions must be met.",
      "properties": {
        "training_level": {
          "type": "array",
          "items": {
            "type": "string",
            "enum": [
              "novice",
              "intermediate",
              "advanced",
              "elite"
            ]
          }
        },
        "days_per_week_min": {
          "type": "integer",
          "minimum": 1,
          "maximum": 7
        },
        "days_per_week_max": {
          "type": "integer",
          "minimum": 1,
          "maximum": 7
        },
        "goal_priority_min": {
          "type": "object",
          "description": "Minimum priority weight required in the goal profile for any modality listed.",
          "additionalProperties": {
            "type": "number",
            "minimum": 0,
            "maximum": 1
          }
        }
      },
      "additionalProperties": false
    },
    "incompatible_with": {
      "type": "array",
      "description": "Other framework IDs that cannot run concurrently with this one, with a reason.",
      "items": {
        "type": "object",
        "required": [
          "framework_id",
          "reason",
          "interference_level"
        ],
        "additionalProperties": false,
        "properties": {
          "framework_id": {
            "type": "string"
          },
          "reason": {
            "type": "string"
          },
          "interference_level": {
            "type": "string",
            "enum": [
              "low",
              "manageable",
              "high"
            ],
            "description": "low = monitor; manageable = apply mitigation rule; high = do not combine"
          },
          "mitigation": {
            "type": "string",
            "description": "What to do if both are needed anyway. e.g. 'Use SS on strength days, CFE rules on conditioning days'"
          }
        }
      },
      "default": []
    },
    "deload_protocol": {
      "type": "object",
      "description": "How a deload week looks within this framework.",
      "properties": {
        "frequency_weeks": {
          "type": "integer",
          "description": "Deload every N weeks. e.g. 4 = deload on week 4 of every block."
        },
        "volume_reduction_pct": {
          "type": "number",
          "minimum": 0,
          "maximum": 1,
          "description": "Reduce volume to this fraction of peak week. e.g. 0.6 = 60% of normal."
        },
        "intensity_change": {
          "type": "string",
          "enum": [
            "maintain",
            "reduce_slightly",
            "reduce_significantly"
          ],
          "description": "What happens to intensity during deload."
        }
      },
      "additionalProperties": false
    },
    "sources": {
      "type": "array",
      "items": {
        "type": "string"
      },
      "default": []
    },
    "notes": {
      "type": "string"
    },
    "cadence_options": {
      "type": "object",
      "description": "Day-of-week patterns per training frequency. Keys are integers (days/week); values are lists of day-number lists (1=Mon, 7=Sun). Multiple options rotate week-to-week.",
      "additionalProperties": {
        "type": "array",
        "items": {
          "type": "array",
          "items": {
            "type": "integer",
            "minimum": 1,
            "maximum": 7
          }
        }
      }
    },
    "recovery": {
      "type": "object",
      "description": "Relaxations of the scheduler's consecutive-day rules. allow_consecutive lists modality pairs that may sit on back-to-back days (a pair of the same id allows that modality twice in a row); phases limits them to named phases, default all.",
      "properties": {
        "allow_consecutive": {
          "type": "array",
          "items": {
            "type": "array",
            "items": { "type": "string" },
            "minItems": 2,
            "maxItems": 2
          }
        },
        "phases": {
          "type": "array",
          "items": { "type": "string" }
        }
      },
      "additionalProperties": false
    },
    "expectations": {
      "type": "object",
      "description": "Time and volume requirements for this framework. Required for all frameworks.",
      "required": [
        "min_weeks",
        "ideal_weeks",
        "min_days_per_week",
        "ideal_days_per_week",
        "min_session_minutes",
        "ideal_session_minutes",
        "supports_split_days"
      ],
      "additionalProperties": false,
      "properties": {
        "min_weeks": {
          "type": "integer",
          "minimum": 1,
          "description": "Minimum program duration in weeks for this framework to be effective"
        },
        "ideal_weeks": {
          "type": "integer",
          "minimum": 1,
          "description": "Ideal/recommended program duration in weeks"
        },
        "min_days_per_week": {
          "type": "integer",
          "minimum": 1,
          "maximum": 7,
          "description": "Minimum training days per week required"
        },
        "ideal_days_per_week": {
          "type": "integer",
          "minimum": 1,
          "maximum": 7,
          "description": "Ideal training days per week for this framework"
        },
        "min_session_minutes": {
          "type": "integer",
          "minimum": 5,
          "description": "Minimum session duration in minutes"
        },
        "ideal_session_minutes": {
          "type": "integer",
          "minimum": 5,
          "description": "Ideal session duration in minutes"
        },
        "ideal_long_session_minutes": {
          "type": "integer",
          "minimum": 5,
          "description": "Optional: ideal duration for long sessions (e.g., weekend endurance work)"
        },
        "supports_split_days": {
          "type": "boolean",
          "description": "Whether this framework supports split sessions (AM/PM training on same day)"
        }
      }
    },
    "modality_priority": {
      "type": "object",
      "description": "Modality importance tiers, used to compress the weekly allocation when the athlete trains fewer days than ideal_days_per_week. Read by src/scheduler.py:_apply_modality_priority.",
      "additionalProperties": false,
      "properties": {
        "committed": {
          "type": "array",
          "items": {
            "type": "string"
          },
          "description": "Always keep at least one slot; never cut."
        },
        "core": {
          "type": "array",
          "items": {
            "type": "string"
          },
          "description": "Keep if the day budget allows; cut after supplementary."
        },
        "supplementary": {
          "type": "array",
          "items": {
            "type": "string"
          },
          "description": "Cut first when compressing."
        }
      }
    },
    "fallback_modalities": {
      "type": "array",
      "items": {"type": "string"},
      "minItems": 1,
      "description": "The modalities that stand in, in order, for a session no archetype of its own modality serves (src/generator.py fallback_order). Without it, every modality with a fallback_rank, by rank."
    },
    "allocation_mode": {
      "type": "string",
      "description": "How sessions_per_week is applied. 'exclusive' allocates only the listed modalities. Read by src/scheduler.py.",
      "enum": [
        "proportional",
        "exclusive"
      ]
    }
  }
}
