[
  {
    "id": "block_periodization",
    "name": "Block Periodization",
    "source_philosophy": "gym_jones",
    "goals_served": [
      "max_strength",
      "strength_endurance",
      "power",
      "mixed_modal_conditioning"
    ],
    "sessions_per_week": {
      "max_strength": 2,
      "mixed_modal_conditioning": 2,
      "durability": 1,
      "aerobic_base": 1
    },
    "intensity_distribution": {
      "zone1_2_pct": 0.2,
      "zone3_pct": 0.15,
      "zone4_5_pct": 0.25,
      "max_effort_pct": 0.4
    },
    "progression_model": "volume_block",
    "applicable_when": {
      "training_level": [
        "intermediate",
        "advanced",
        "elite"
      ],
      "days_per_week_min": 4,
      "days_per_week_max": 6,
      "goal_priority_min": {
        "max_strength": 0.2
      }
    },
    "incompatible_with": [
      {
        "framework_id": "linear_progression",
        "reason": "Block periodization assumes accumulated training history and deliberate phase shifts. Linear progression's session-by-session load increases are incompatible with block volume/intensity sequencing.\n",
        "interference_level": "high",
        "mitigation": "Do not combine. Exhaust linear progression first, then transition to block work.\n"
      },
      {
        "framework_id": "rpe_autoregulation",
        "reason": "Block periodization uses pre-planned percentage-based loading within each phase. RPE autoregulation replaces prescribed percentages with feel-based load decisions, which undermines the structured volume-to-intensity progression of each block.\n",
        "interference_level": "manageable",
        "mitigation": "Use RPE to fine-tune load within block targets (e.g. RPE 8 on the top set of a volume block). Do not use RPE to bypass block phase structure.\n"
      }
    ],
    "deload_protocol": {
      "frequency_weeks": 4,
      "volume_reduction_pct": 0.6,
      "intensity_change": "maintain"
    },
    "sources": [
      "Gym Jones — Operator Fitness I & II (Twight)",
      "Gym Jones — Soldier of Steel",
      "Horsemen Training Program 2008",
      "Supertraining, Verkhoshansky"
    ],
    "notes": "Organizes training into sequential 4-6 week phases: Accumulation (high volume, moderate intensity) → Transmutation (moderate volume, higher intensity) → Realization (low volume, peak intensity/performance). Used by Gym Jones for operator fitness programming and by Horsemen across their 4-month macro (Month 1 Strength → Month 2 Power Endurance → Month 3 Job Specific → Month 4 Maintenance). Hard/easy day alternation is built into the weekly structure. Progression levers: reduce rest periods for bodyweight-based work; increase load for barbell/KB work — never both simultaneously (Twight rule).\n"
  },
  {
    "id": "concurrent_training",
    "name": "Concurrent Training (GPP / Balanced Fitness)",
    "source_philosophy": "horsemen_gpp",
    "goals_served": [
      "max_strength",
      "aerobic_base",
      "mixed_modal_conditioning",
      "durability",
      "strength_endurance"
    ],
    "sessions_per_week": {
      "max_strength": 2,
      "aerobic_base": 2,
      "mixed_modal_conditioning": 1,
      "durability": 1,
      "strength_endurance": 1
    },
    "intensity_distribution": {
      "zone1_2_pct": 0.3,
      "zone3_pct": 0.15,
      "zone4_5_pct": 0.25,
      "max_effort_pct": 0.3
    },
    "progression_model": "rpe_autoregulation",
    "applicable_when": {
      "training_level": [
        "intermediate",
        "advanced",
        "elite"
      ],
      "days_per_week_min": 4,
      "days_per_week_max": 6,
      "goal_priority_min": {
        "aerobic_base": 0.15
      }
    },
    "incompatible_with": [
      {
        "framework_id": "linear_progression",
        "reason": "Concurrent training's conditioning volume and fatigue accumulation prevents the session-to-session recovery that linear progression requires. The interference effect is well-documented: endurance work blunts strength adaptation when both are pursued at full volume.\n",
        "interference_level": "high",
        "mitigation": "If a novice needs both, run a minimal linear progression (3×/week barbell) and strictly cap conditioning at 2 low-intensity sessions/week. Accept slower strength gains. Transition to true concurrent programming once linear progress stalls.\n"
      },
      {
        "framework_id": "high_frequency_skill",
        "reason": "Adding daily skill sessions on top of a full concurrent training week creates excessive total training volume and degrades movement quality — the opposite of what high-frequency skill work is designed to achieve.\n",
        "interference_level": "manageable",
        "mitigation": "Replace one conditioning session with a skill session, or limit skill practice to 10-15 min movement prep before existing sessions rather than standalone daily sessions.\n"
      }
    ],
    "deload_protocol": {
      "frequency_weeks": 4,
      "volume_reduction_pct": 0.6,
      "intensity_change": "reduce_slightly"
    },
    "sources": [
      "Horsemen Training Program 2008",
      "Gym Jones — Operator Fitness I & II (Twight)",
      "Concurrent Training: A Meta-Analysis, Wilson et al.",
      "Uphill Athlete — Concurrent supplementary strength protocols"
    ],
    "notes": "Concurrent training alternates strength and conditioning sessions within the same week. The primary challenge is interference: endurance adaptations (mitochondrial biogenesis, slow-twitch hypertrophy) can blunt strength/power adaptations when both are maximally pursued. Fatigue management is the governing concern, not progressive overload on any single quality. Goal priority weighting drives session allocation: a goal profile with aerobic_base 0.5 + max_strength 0.2 allocates more session slots and total weekly volume to aerobic work. Horsemen 4-day template (Mon strength, Tue conditioning, Thu carries + bodyweight, Sat long ruck/GPP) is a canonical implementation. RPE autoregulation governs load daily to account for accumulated fatigue across modalities.\n"
  },
  {
    "id": "emom_amrap",
    "name": "EMOM / AMRAP Conditioning",
    "source_philosophy": "crossfit",
    "goals_served": [
      "mixed_modal_conditioning",
      "strength_endurance",
      "anaerobic_intervals",
      "power"
    ],
    "sessions_per_week": {
      "mixed_modal_conditioning": 3,
      "strength_endurance": 1
    },
    "intensity_distribution": {
      "zone1_2_pct": 0.05,
      "zone3_pct": 0.3,
      "zone4_5_pct": 0.5,
      "max_effort_pct": 0.15
    },
    "progression_model": "density",
    "applicable_when": {
      "training_level": [
        "novice",
        "intermediate",
        "advanced",
        "elite"
      ],
      "days_per_week_min": 2,
      "days_per_week_max": 5,
      "goal_priority_min": {
        "mixed_modal_conditioning": 0.25
      }
    },
    "incompatible_with": [
      {
        "framework_id": "linear_progression",
        "reason": "Frequent high-intensity conditioning sessions accumulate systemic fatigue that prevents the recovery required for session-to-session load increases. More than 2 EMOM/AMRAP sessions per week will stall or reverse linear strength progression.\n",
        "interference_level": "high",
        "mitigation": "Limit to 1 short conditioning session per week (under 15 min, lower intensity). Schedule on a day between strength sessions, never the day before a heavy barbell day. Accept that linear strength progression will slow.\n"
      },
      {
        "framework_id": "polarized_80_20",
        "reason": "EMOM/AMRAP work predominantly sits in Zone 3-4 (\"moderate intensity danger zone\" in polarized theory), which accumulates fatigue without contributing to aerobic base development. Substituting Zone 1-2 sessions with EMOM work violates the 80% low-intensity rule.\n",
        "interference_level": "manageable",
        "mitigation": "Treat EMOM/AMRAP sessions as the 20% high-intensity allocation only. Do not add EMOM work on top of the polarized interval quota. Total high-intensity sessions remain capped at 20% of weekly volume.\n"
      }
    ],
    "sources": [
      "CrossFit Training Guide (Glassman)",
      "CrossFit Endurance methodology",
      "Horsemen Training Program 2008 — Density/EMOM workouts",
      "Gym Jones — Accumulation Day protocols"
    ],
    "notes": "EMOM (Every Minute On the Minute) and AMRAP (As Many Rounds/Reps As Possible) are session formats, not standalone periodization systems. As a framework, they represent a conditioning-dominant programming approach where the session structure itself is the progression vehicle: same movements in less time (AMRAP), or maintaining output across all intervals (EMOM). Density progression means the athlete's ability to complete more work within the fixed time domain. EMOM format can be applied to strength movements (EMOM strength waves: 10×1 at 85-95%) or pure conditioning (Horsemen \"Purple Church\": 10 min EMOM, 3 power clean + 3 hang squat clean + 3 push press). AMRAP format (CrossFit metcons, Horsemen \"PBR\": AMRAP 20 min) targets mixed-modal work capacity. Can be used as a standalone conditioning framework or as conditioning days within a concurrent training block.\n"
  },
  {
    "id": "gpp_circuits",
    "name": "GPP Circuits (Horsemen / SOF-style)",
    "source_philosophy": "horsemen_gpp",
    "goals_served": [
      "durability",
      "strength_endurance",
      "mixed_modal_conditioning",
      "max_strength"
    ],
    "sessions_per_week": {
      "durability": 2,
      "mixed_modal_conditioning": 1,
      "max_strength": 1
    },
    "intensity_distribution": {
      "zone1_2_pct": 0.1,
      "zone3_pct": 0.35,
      "zone4_5_pct": 0.35,
      "max_effort_pct": 0.2
    },
    "progression_model": "time_to_task",
    "applicable_when": {
      "training_level": [
        "novice",
        "intermediate",
        "advanced",
        "elite"
      ],
      "days_per_week_min": 2,